commit	val_f1	f1_bin	f1_cat	val_f1_zs	f1_zs	f1_cat_zs	f1_posts	f1_comments	time	status	description
60a2690	INTENT_organic_note	1	0.7001	0.7612	0.5760				discard
7a19660	probe_opening_probing	1	0.6658	0.7245	0.5466				discard
50998fa	probe_opening_initial	1	0.6701	0.7188	0.5690				discard
d9dac54	vote_Message_label	1	0.7004	0.7396	0.6168				discard
89a00be	vote_Text_label	1	0.6769	0.7462	0.5392				discard
26d152b	vote_swap_reminder_order	1	0.7031	0.7170	0.6718				discard
ecff84c	vote_Submission_label	1	0.6893	0.7287	0.6054				discard
1757574	fmt_feedback_No_interview	1	0.6614	0.7321	0.5218				discard
5517a16	fmt_feedback_bracket_none	1	0.6756	0.7321	0.5601				discard
534bad1	seed_temp_0.58	1	0.6786	0.7586	0.5231				discard
bc9e42f	finalize_temp_0.62	1	0.6953	0.7321	0.6164				discard
7e87d64	combo_Evaluate_poster_goals	1	0.6918	0.7472	0.5780				discard
c247648	probe_natural_vs_direct	1	0.6632	0.7433	0.5083				discard
df25bb2	probe_concise_vs_short	1	0.6973	0.7328	0.6210				discard
b5eb3a8	INTENT_if_any_qualifier	1	0.6673	0.7361	0.5308				discard
e0bd813	vote_content_community_interview	1	0.7013	0.7463	0.6065				discard
da61116	probe_no_preamble	3	0.6795			0.7246	0.6587	0.6552	discard
00d257b	probe_output_question_only	1	0.7130	0.7452	0.6430				discard
1dee056	vote_Interview_log	1	0.6357	0.6940	0.5179				discard
e9064eb	vote_Interview_transcript	1	0.6950	0.7336	0.6127				discard
c9d79d2	INTENT_your_task_is_to	1	0.6579	0.6835	0.6019				discard
33c792b	vote_most_likely_category	1	0.6837	0.7413	0.5660				discard
286e861	vote_Moltbook_content_label	1	0.7126	0.7605	0.6123				discard
a0b617d	vote_Post_comment_label	1	0.6661	0.7176	0.5599				discard
b99f0d8	probe_opening_content_first	1	0.6851	0.7566	0.5435				discard
56b40aa	probe_curious_community_member	1	0.6345	0.7082	0.4911				discard
67b6448	probe_Write_vs_Generate	1	0.7110	0.7510	0.6259				discard
df72dab	finalize_n20	1	0.6534	0.7143	0.5308				discard
a6ddf2d	vote_Forum_label	3	0.6992			0.7179	0.6740	0.7056	discard
50d3fcb	vote_Channel_label	1	0.6717	0.7308	0.5518				discard
d04413c	probe_why_posted_in_community	1	0.6896	0.7471	0.5721				discard
6d8ecb0	vote_Section_label	1	0.6928	0.7452	0.5844				discard
af2c85e	probe_Post_content_label	1	0.6862	0.7341	0.5863				discard
8066d6a	vote_Group_label	1	0.6562	0.7519	0.4777				discard
7309e08	probe_temp_0.8	1	0.6723	0.7547	0.5132				discard
2840431	refine_n4	1	0.7010	0.7794	0.5473				discard
f25a3fc	combo_Moltbook_content_Write	1	0.6608	0.7266	0.5297				discard
8c06a24	probe_temp_0.72	1	0.7006	0.7444	0.6083				discard
9c943f3	probe_temp_0.68	3	0.6937			0.7152	0.7086	0.6572	discard
a1f585b	probe_Craft	1	0.6920	0.7126	0.6460				discard
d25943b	INTENT_determine	1	0.6489	0.7431	0.4730				discard
45473ea	probe_expose	1	0.6844	0.7154	0.6172				discard
aec6d80	probe_true_intent	1	0.6785	0.7510	0.5355				discard
da48512	probe_output_question_only	1	0.7095	0.7463	0.6306				discard
40bc85d	probe_concise	1	0.6582	0.7368	0.5058				discard
84dc3eb	probe_underlying_intent	1	0.6564	0.7170	0.5342				discard
